{
  "schema_version": "1.0",
  "session_id": "calib-20260729-001",
  "sensor": {
    "model": "TOFSense F2P",
    "serial_number": "F2P-TBD",
    "firmware_version": "TBD",
    "interface": "UART",
    "baud_rate": 921600
  },
  "frames": {
    "point_cloud_frame": "lidar_scan",
    "camera_frame": "camera_optical",
    "convention": "+x right, +y down, +z forward; pan positive right; tilt positive up"
  },
  "units": {
    "distance": "meter",
    "angle": "radian",
    "timestamp": "nanosecond",
    "device_time": "millisecond",
    "signal_strength": "raw_uint16"
  },
  "clock": {
    "time_base": "host_monotonic",
    "host_clock": "CLOCK_MONOTONIC_RAW",
    "device_to_host_offset_ns": null,
    "max_sync_error_ns": 1000000
  },
  "scan": {
    "scan_id": "sweep-000001",
    "started_at_ns": 481923000000000,
    "ended_at_ns": 481925500000000,
    "rows": 2,
    "columns": 3,
    "pan_min_rad": -0.7,
    "pan_max_rad": 0.7,
    "tilt_min_rad": -0.45,
    "tilt_max_rad": 0.45,
    "ordering": "row_major",
    "row_direction": "tilt_max_to_min",
    "column_direction": "pan_min_to_max",
    "pattern": "raster_unidirectional",
    "motion_direction": "forward",
    "sample_count": 6,
    "valid_count": 5
  },
  "mechanical": {
    "pan_zero_offset_rad": 0.0,
    "tilt_zero_offset_rad": 0.0,
    "backlash_compensated": false
  },
  "measurements": [
    {
      "sequence": 0,
      "row": 0,
      "column": 0,
      "timestamp_ns": 481923000100000,
      "device_time_ms": 10001,
      "encoder_timestamp_ns": 481923000080000,
      "pan_rad": -0.7,
      "tilt_rad": 0.45,
      "pan_encoder_count": 1024,
      "tilt_encoder_count": 3072,
      "distance_m": 2.221,
      "distance_status": 0,
      "signal_strength": 159,
      "range_precision_m": 0.01,
      "checksum_valid": true,
      "interpolation_valid": true,
      "valid": true,
      "quality_flags": [
        "VALID_RANGE"
      ]
    },
    {
      "sequence": 1,
      "row": 0,
      "column": 1,
      "timestamp_ns": 481923010100000,
      "device_time_ms": 10011,
      "encoder_timestamp_ns": 481923010080000,
      "pan_rad": 0.0,
      "tilt_rad": 0.45,
      "pan_encoder_count": 2048,
      "tilt_encoder_count": 3072,
      "distance_m": null,
      "distance_status": 4,
      "signal_strength": 0,
      "range_precision_m": null,
      "checksum_valid": true,
      "interpolation_valid": true,
      "valid": false,
      "quality_flags": [
        "DISTANCE_STATUS_INVALID"
      ]
    },
    {
      "sequence": 2,
      "row": 0,
      "column": 2,
      "timestamp_ns": 481923020100000,
      "device_time_ms": 10021,
      "encoder_timestamp_ns": 481923020080000,
      "pan_rad": 0.7,
      "tilt_rad": 0.45,
      "pan_encoder_count": 3072,
      "tilt_encoder_count": 3072,
      "distance_m": 3.145,
      "distance_status": 0,
      "signal_strength": 142,
      "range_precision_m": 0.01,
      "checksum_valid": true,
      "interpolation_valid": true,
      "valid": true,
      "quality_flags": [
        "VALID_RANGE"
      ]
    },
    {
      "sequence": 3,
      "row": 1,
      "column": 0,
      "timestamp_ns": 481924000100000,
      "device_time_ms": 11001,
      "encoder_timestamp_ns": 481924000080000,
      "pan_rad": -0.7,
      "tilt_rad": -0.45,
      "pan_encoder_count": 1024,
      "tilt_encoder_count": 1024,
      "distance_m": 1.876,
      "distance_status": 0,
      "signal_strength": 201,
      "range_precision_m": 0.01,
      "checksum_valid": true,
      "interpolation_valid": true,
      "valid": true,
      "quality_flags": [
        "VALID_RANGE"
      ]
    },
    {
      "sequence": 4,
      "row": 1,
      "column": 1,
      "timestamp_ns": 481924010100000,
      "device_time_ms": 11011,
      "encoder_timestamp_ns": 481924010080000,
      "pan_rad": 0.0,
      "tilt_rad": -0.45,
      "pan_encoder_count": 2048,
      "tilt_encoder_count": 1024,
      "distance_m": 2.011,
      "distance_status": 0,
      "signal_strength": 188,
      "range_precision_m": 0.01,
      "checksum_valid": true,
      "interpolation_valid": true,
      "valid": true,
      "quality_flags": [
        "VALID_RANGE"
      ]
    },
    {
      "sequence": 5,
      "row": 1,
      "column": 2,
      "timestamp_ns": 481924020100000,
      "device_time_ms": 11021,
      "encoder_timestamp_ns": 481924020080000,
      "pan_rad": 0.7,
      "tilt_rad": -0.45,
      "pan_encoder_count": 3072,
      "tilt_encoder_count": 1024,
      "distance_m": 2.647,
      "distance_status": 0,
      "signal_strength": 173,
      "range_precision_m": 0.01,
      "checksum_valid": true,
      "interpolation_valid": true,
      "valid": true,
      "quality_flags": [
        "VALID_RANGE"
      ]
    }
  ],
  "diagnostics": {
    "received_frame_count": 6,
    "checksum_error_count": 0,
    "status_invalid_count": 1,
    "encoder_interpolation_error_count": 0,
    "dropped_frame_count": 0
  }
}
